{
  "schemaVersion": 1,
  "id": "whisper-base-q5_1",
  "version": "f281eb45af861ab5e5297d23694b7d46e090c02c",
  "source": "https://huggingface.co/ggerganov/whisper.cpp/resolve/f281eb45af861ab5e5297d23694b7d46e090c02c/ggml-base-q5_1.bin",
  "artifactPath": "models/transcription/ggml-base-q5_1.bin",
  "sha256": "422f1ae452ade6f30a004d7e5c6a43195e4433bc370bf23fac9cc591f01a8898",
  "bytes": 59707625,
  "runtime": {
    "engineId": "whisper_cpp",
    "modelFormat": "ggml"
  },
  "license": {
    "id": "MIT",
    "snapshotPath": "models/licenses/openai-whisper-model-MIT.txt"
  },
  "capabilities": ["transcription"],
  "enabledModes": ["postSession"]
}
