{
  "schemaVersion": 1,
  "id": "whisper-small-q5_1",
  "version": "f281eb45af861ab5e5297d23694b7d46e090c02c",
  "source": "https://huggingface.co/ggerganov/whisper.cpp/resolve/f281eb45af861ab5e5297d23694b7d46e090c02c/ggml-small-q5_1.bin",
  "artifactPath": "models/transcription/ggml-small-q5_1.bin",
  "sha256": "ae85e4a935d7a567bd102fe55afc16bb595bdb618e11b2fc7591bc08120411bb",
  "bytes": 190085487,
  "runtime": {
    "engineId": "whisper_cpp",
    "modelFormat": "ggml"
  },
  "license": {
    "id": "MIT",
    "snapshotPath": "models/licenses/openai-whisper-model-MIT.txt"
  },
  "capabilities": ["transcription"],
  "enabledModes": ["postSession"]
}
